"labels","text"
"not-current","glad my 1st experience with vapeing wasnt with a gross juice #smokefree5months"
"current","Glass of wine great friends cigar lounge #fridaynight #thisisthelife"
"current","Glass of wine cigarette amp Tchaikovsky I'm so cultured innit"
"current","god damn there's something about smoking a cigarette in bed I'm in love with"
"current","goin to the hookah bar saturday"
"current","going back to vaping"
"current","Going on like I don't smoke 45685 cigs a day"
"current","going outside to smoke but it's too fucking cold to finish a cigarette"
"current","Gonna smoke and listen to Alan Watts"
"current","Good Morning Everyone Coffee and Cig"
"current","Got a Dab rig vape and some sugar wax learned quickly dabing and vapeing is life #onemore"
"current","got a face mask on n i'm smokin a cig sippin coffee on my back porch in my silk robe and excessively fuzzy pink slippers this is l i v i n"
"current","Got all my hookah stuff now"
"not-current","Got drunk woke up to all my kitchen stools knocked over a cig on my floor and my tv broken"
"current","Got glass of red wine a cigarette Sitting out in deck while neighbor plays classic Blues and Jazz on stereo #lifeisgood"
"current","Got my brews got my smoke got my pen n my pad #InMyOwnZone #LikeThat"
"current","Got my cigg at bpp hahahaha lazy find at hillion so big"
"current","Got my vape coming in the mail and Apple Watch this weekend"
"current","Got the hookah going"
"current","got the incense lit its smoke time"
"current","Got the patio furniture back out cigar lit beer cracked my kinda weather #HappyKyle #HappyMilo"
"current","Gotta stop smoking drunk cigs"
"current","Grab a bottle food and light the hookah over going out anydayyy"
"current","Granny just passed my uncle out here smoking glass"
"current","Guess I should smoke a cigg and try and sleep"
"current","Guy at McDonald asked if we wanted to smoke"
"not-current","ha ha ha ha ha I burnt half my eye lashes off with a lighter trying to smoke while also laying down"
"current","Half time at work smoke session"
"current","hand me a cigarette dawggggg"
"current","Hanging out by myself drinking and smoking and hooping The life"
"not-current","Haven't been to the hookah bar in a long time"
"not-current","Haven't been to the hookah bar in forever forgot how to smoke it"
"not-current","haven't even had my juul for 2 months nd it won't charge anymore"
"current","Haven't hit a blunt in 5 months bout to turn to cigarettes"
"not-current","Haven't smoked in a month Them paccs keep me calm tho"
"not-current","haven't smoked in idk how long so tbh I don't even know how it feels to smoke in your own shit"
"not-current","Haven't smoked in two weeks"
"not-current","Haven't smoked my e cig in two days or put a smoke in my mouth don't even want to either taste will be rotten"
"current","Having a cig and talking to Daren about life on the garage steps will 4ever be my favorite thing to do"
"current","Heading down for coffee and cig"
"current","Heading to a cigar bar"
"current","hello my name is je4emy and I love to vape"
"current","Hereby marking the time of my last and final cigarette"
"current","hey twitter just got back from the gym now im gunna go vape and mod out my car"
"current","hi someone pls bring me taco bell and cigarettes to hooters i work a double and ill kiss u or something"
"current","Hi #blunation I'm currently enjoying my e cig's in Vanilla and Caramel Cafe'"
"current","Hi I want to use a UK registered card for delivery of Juul Pods and Juul starter kit to a US (NYC) address Is that possible"
"current","Hit the vape pen salute the flag grab a pussy and go squat 315 x 5"
"not-current","Hm #NoSmokingDay I quit decades ago but am inclined to go buy a packet of cigs today just to demonstrate I won't be constrained by taboo"
"current","Hold tight all my early birds coffee and a cig then its a 170 studio sesh and gambling on footy long live saturday mornings"
"current","Home alone smoking typical weekend"
"current","Home alone with coffee cigarette and music This is a good morning"
"current","Home alone smoking playing piano"
"current","hooka bar tonite 9 until 754 marshall rode for my bday"
"current","Hooka bar for my birthday no pants just dresses and skirts"
"current","Hooka bar kinda night"
"current","Hooka is dead ass trash that shit gives me a crazy ass headache"
"current","Hooka with my girls"
"current","Hookah tonight till I'm off the shits and the room feels like a MerryGoRound OFFF THE SHITTTTS"
"current","Hookah amp Movies"
"current","Hookah amp wine"
"current","Hookah amp wine"
"current","Hookah and beer"
"current","Hookah and beer type of night"
"current","hookah and drinks"
"current","Hookah and Hennesey the way to my mean ass"
"current","Hookah and ice cream"
"current","hookah and study part 5 is going pretty good"
"current","Hookah and venting with my babe -MENTION- Hannah N"
"current","Hookah and wine"
"current","Hookah and working on music in my zone"
"current","Hookah bar"
"current","Hookah bar surprise"
"current","Hookah bar gt gt gt"
"current","Hookah bar again on Friday"
"current","hookah bar bound"
"current","hookah bar for lil Georges bday lol"
"current","Hookah bar"
"current","Hookah bar"
"current","Hookah Bar"
"current","Hookah bar now"
"current","Hookah bar pull up"
"current","Hookah bar this weekend"
"current","Hookah Bar This Weekend"
"current","Hookah bar time Someone come thru"
"current","Hookah bar tonight"
"current","Hookah bar w my beautiful baby girl -MENTION-"
"current","Hookah bar w my bros soon"
"current","Hookah bar with bae"
"current","Hookah Bar with the gang"
"current","Hookah bar"
"not-current","hookah breath"
"current","Hookah dead Time for bed"
"not-current","Hookah got my head on fire"
"current","Hookah is real love"
"current","hookah lounge anyone"
"current","Hookah lounge byob till 5ish"
"current","Hookah Lounge playing trash right now"
"current","hookah lounge with my ff -MENTION-"
"current","Hookah lounges in queens real wocky lol"
"current","Hookah thurs"
"current","Hookah time"
"current","HOOKAH TIME -MENTION-"
"current","Hookah time #Ultra2017"
"current","Hookah time"
"current","hookah time"
"current","Hookah time"
"current","Hookah x Wine"
"current","Hookah brunch latt s and my turtle"
"current","how do I order to smoke"
"not-current","how i spend 200 @ the hookah bar"
"current","How much street cred do i get for vaping #vape #vapemaster"
"current","How tf do I find myself happy vaping over rolling a cig Younger me is so disappointed"
"current","hugewasteofmoney I need to stop smoking cigarettes hugewasteofmoney"
"current","i accidentally learned how to do that dragon vape trick thing i now promote myself to ultimate vape lordt"
"not-current","I aint smoke hookah since sat im doin better"
"current","i almost burned myself with my cigarette wildt"
"not-current","I almost set my hair on fire trying to lit up my cigarette"
"current","I always smoke so if I burn amp you w me we obviously smoking together it's g but don't expect to smoke out you literally every time"
"current","I am #vaping my 6 dollar fake Kennedy on an eleaf 200watt somethong or other In case you were wondering"
"current","I am an hookah enthusiast I swear"
"current","i am drunk and tried to light a cig but lit it from the filter this is now the second time i've done this"
"current","I am enjoying a good cigar with my evening constitutional inside of course"
"current","I am fueled by coffee and cigarettes"
"current","I am holding my cigarette in the anger position since you're so terrible at reading non verbal cues"
"current","I am in Indiana up way past my bedtime smoking 2 drags off a cig n idgaf sum1 plz call the cops"
"current","I am on mdma dancing around my pool listening to Fleetwood mac smoking a cigarette"
"current","i am smoking a cig in jamaica"
"current","I am smoking but doing my homework bc priorities"
"not-current","I am so tired I just picked up my vape and tried to drink from it"
"current","I am thinking of getting a job so I can buy cigarettes and getting my nails done and getting my hair cut"
"current","I b gettin tired of smoking outta boredom but den I b like Ima smoke regardless"
"current","I be craving cigarettes so bad man fuck"
"current","I been smoking this cigar too long Almost ratchet tv time"
"current","I been smoking to much lately man"
"current","I been so calm lately or maybe cause I smoke and think a lot"
"not-current","I bought a pack of cigs lastnight I fucking hate myself but this malboro black feels so right on my lips"
"current","I bought brownie and mint chocolate shisha I'm really excited to try it out That's how lame I am lol"
"not-current","I bought dried leaves to vape n got raspberry leaf amp orange blossom Bought orange blossom for depression but it's to help with anxiety"
"current","i burned myself w my cig lmfao great"
"not-current","I came out here to smoke not watch mall security vape and assault a shopping cart"
"current","i can legally drink and smoke tobacco in canada on thursday"
"not-current","i can't believe i walked around smelling like cigarette for 6 years"
"current","I can't believe some of the shit I hear at work while smoking all imma say is ""ladies suck ya mans dick"" cause some scuttlebucket will"
"current","I can't eat unless I smoke if I don't smoke I won't have appetite"
"not-current","I can't feel my face I was just date vaped"
"current","I can't fw hookah while I'm drinkin"
"current","i can't wait to smoke a cigarette"
"current","I can't wait to smoke mojito flavored cigarettes with Patri again"
"current","I can't wait until I'm in Florida with a beer in my hand smoking a cigar on the beach"
"current","I CANT WAIT TO VAPE IN IT"
"current","I could use a cigarette right about now"
"not-current","i couldn't sleep so i just vaped a bunch of mugwort and now i simultaneously feel witchy as hell and like the biggest loser of all time"
"current","I deal with stress by blocks of cigarets coffee sleep abuse sleep deprivation and emotional spikes All that sounds rather unhealthy"
"not-current","I didn't freeze my balls off smoking a cig today"
"current","I don't do no talkin when I smoke"
"current","I don't even b using chewing tobacco I Jss b eating cigarettes"
"current","I don't know how to stop smoking cigs but I need to start figuring it out"
"current","I don't think the new roomie appreciates my vaping habit"
"not-current","I don't understand how Harry has convinced me to come out to a shisha bar"
"current","I drink the venom to release the pain Chain smoking I'll suffocate"
"current","I enjoy how generic my morning is with cigarette daydreams coffee and a cigarette"
"current","I envy people who dont crave cigarettes and just smoke when they drink"
"current","i feel like an old man sitting outside smoking a cig"
"current","I feel like having those deep convos over a glass of wine ciggs in place biltong and snacks"
"current","I feel like hearing music smoking out have one drink an a few dances"
"current","I feel like shit and I probably shouldn't be vaping but the STRESS FAM"
"current","I feel like smoking"
"current","i feel like walking out the gym and rewarding myself by chain smoking 5 cigarettes is probably quite counterintuitive baby steps"
"current","I find myself every night or ever other night doing hookah #addiction #applemint #"
"current","I forgot my phone while on the toilet so I spent my time ready a tobacco pouch found in my pocket #struggle"
"current","I forgot to smoke more"
"current","i go to the hookah lounge every so often but i don't really count that as smoking"
"current","I got waiting for the first person to get my hookah right dm me"
"not-current","i got a piece a lil piece amp a capsule that's also a grinder amp i hardly smoke anymore lmao"
"current","I got a project in mind so wine glass and cigar I'm getting the beats together"
"current","I got a project in mind so wine glass and cigar I'm getting the beats together"
"current","I got cigs in my ear like -MENTION- so you know i'm feelin good"
"current","I got my own cloud 9 right here in bed this hookah machine a beast bruh"
"not-current","I got reallly nostalgic about menthol cigarettes I miss smoking sometimes"
"current","i gotta finds me a bitch that can hit the #juul like i can"
"current","I gotta stop smoking cigarettes Fr"
"not-current","I had my first cigarette since January today lol"
"not-current","I had the cops called on me for smoking an electronic cigarette outside at Waterfront in DC Asked them to arrest me They declined"
"current","I hate and love the fact that i hate and love smoking"
"current","I hate black and mild amp Cigarette smoke eww tf"
"current","I hate cigarettes"
"current","I hate my cigarette cravings"
"current","I hate my life vaping darkslategray"
"current","I hate myself so much I'll probably start vaping again"
"current","I hate smoking in my car because I feel like that shit takes so long to completely air out I got like 3 air freshness and febreeze"
"current","I have made the financial decision that I am purchasing a JUUL"
"current","I have not vaped at all today It completely sucks but that's ok because I'm healthy now goddammit"
"not-current","I haven't actually smoked in about a month and a half maybe two and I just can't express how good I feel"
"not-current","I haven't smoked hookah for a whiiiileeeeeeee and now I'm light headed asf"
"not-current","I haven't smoked in 4 days I'm proud of myself"
"not-current","I haven't smoked in like two weeks"
"not-current","I haven't smoked in over 24 hours how tf am I supposed to sleep"
"not-current","I haven't smoked In so long"
"not-current","I haven't smoked weed like in 2 days who am I lol I've just been smoking cigarettes"
"current","I haven't vaped in a while idk if I should go back to vaping or not"
"not-current","i havent smoked in so damn long"
"current","i honestly can't wait to go home make pizza and smoke hookah oh and cuddle with my dogs"
"current","i honestly might try vaping or something maybe the nicotine will help with stress and shit"
"current","I honestly think it's really nice when people compliment me on my vape juice mix"
"current","I hope I find another cigar"
"current","I hotbox my car with a juul bc I'm a cool kid lmao"
"not-current","I hung out with a vape"
"not-current","I just ashed my cigarette in my captain crunch"
"current","i just ashed my cigarette with such force that the filter came off then burnt myself trying to light a new one why am i such a mess yikes"
"not-current","I just bought some cigarettes sooooo fw ya girl"
"current","I just burnt myself on my foot w my cigarette if that doesn't show how drunk i am idk what will"
"not-current","I just drank camilas fucking ecig juice"
"not-current","I just dropped a glass bottle of tobacco all over my kitchen floor So that's how my night is going"
"not-current","i just dropped my cigar off the balcony wtf"
"current","I just drove all the way home and back to school because I forgot my cigarettes"
"current","i just got out of the shower amp now i want a cig"
"not-current","I just got the biggest headrush from my juul i might passout omg"
"not-current","I just had a panic attach and smoked a cigaret at the frozen beach who tf am I"
"current","i just lit a cig the wrong way"
"current","I just lit my cig backwards"
"current","i just lit my cig with an electric stove lmao"
"not-current","I just lit my cigarette at the filter #fuckme"
"current","I just need a cig ("
"current","I just packed my cigs the wrong way"
"current","I just remembered why I don't hang around naked I just burned my penis with a cigarette Ow ow ow"
"not-current","i just set the fire alarm off in my room from vaping this has gone too far"
"current","I JUST SHOT A CIG OUT OF MY MOUTH 2 3 FEET THEN CAUGHT IT THE RIGHT WAY IN MY MOUTH"
"not-current","I just smoked with him and he didn't flirt with me but it was cool I had my bathing suit on but we didn't swim"
"current","I just tried to bake my room with vape and now I have hiccups wtf y0"
"current","I just tried to light my cigarette w my lipstick sooo there's that"
"not-current","I just vaped in front on my mom and she gasped and said ""you took a hit """
"current","i just wanna smoke my cig bruh"
"current","I just want to smoke a fucking cigarette"
"current","I just work smoke hooka and sleep #nofriends"
"current","I keep saying I'm done smoking but I continue to smoke"
"current","i kept saying i'll cut down on my ciggs but i kept smoking more zzzz"
"not-current","I knocked over the hookah and a coal fell on my leg and now there's a big welt ("
"current","I know too much im tryna smoke myself stupid"
"current","I laughing at my phone outside of bif cat smoking a cig at night"
"current","I leave my cigarettes in my room everyday and everyday I regret it"
"current","i left my vape at home this is going to be a shitty day"
"current","I like hookah"
"current","I like smoking cigarettes with my friends"
"current","I lit the wrong end of my cigarette"
"current","i literally just walk out side with a cigarette"
"current","i look forward to buying coffee and enjoying a cigarette tomorrow"
"current","I look like I eat cigarettes for breakfast lmaoooo wow I hate myself"
"current","I love downtown smoke nights"
"current","I love finding my e cig under my pillow like an adult tooth fairy"
"current","I love hookah Like too much"
"current","I love listening to calming music while I'm smoking"
"current","I love smoking in my porch"
"current","I love smoking papers"
"current","I LOVE TOBACCO MORE THAN MY PARENTS"
"current","I mean I just ate about 2 hours ago but I'm ready for a big ol joint a whole box of wine mass cigs and some gd TACO BELL"
"current","I might be town bitch but I'm also smoking in doors at my favorite bar Sooooo"
"current","I misplaced my vape but it's ok I also convinced myself it's in one of my jackets #typical"
"current","i miss cigarette"
"current","I miss sitting outside smoking lol"
"current","I miss smoking cigs on the beach at 2am"
"not-current","I miss the days when I could just smoke and make music"
"not-current","I miss the late nights and fires beside the river sneaking beer and cigs hoping cops didn't pull up"
"current","I need a cigarette"
"current","I need a cigarette to deal with all of these irrelevant ass people trying to hijack my energy I cba"
"current","i need a cigarette)"
"current","I NEED A FUCKIN CIGARETTE"
"current","I need a mocha frappe and a cigar this morning"
"current","I need fckn liquor and hooka already smh"
"current","i need money for cigarets"
"current","i need money for cigarets xxxxxxxxxxxxxxxxxxxxxxxxxxxxxxxxxxxxxxxxxxxxxxxxxxx"
"current","I need some healing right now the way I'm smoking"
"current","I need to be sippin Don Julio on a balcony somewhere on the coast maybe even a nice cigar"
"current","I need to smoke"
"current","i needa cig"
"current","I needa smoke this one away"
"current","I needed my cigarettes"
"current","I neeeeeeeed a cig so badly lol"
"current","i only have 3 cigarettes but watch me smoke two of them on this break"
"not-current","I only just lit my cig and the bus came just my fucking luck"
"not-current","i only vaped once and i choked on the smoke"
"current","I probably wouldn't smoke as much if I had something to occupy me"
"not-current","i really stopped my vape"
"not-current","I remember having hookah session with homies good times"
"not-current","I remember smoking in back of the mall and I got chased by the 12"
"current","I roll cigarettes with no filter wear vans and I'm an absolute fukkin waste"
"current","I saw 1984 last night for 1st time It's happening I need a glass of good scotch and 2 Marlboro reds before it all goes boom"
"current","i sent my helper earlier to get some cigarettes and this motherfucker brought back some virginia slims"
"not-current","I shit real good at my grannys cause we drink coffee and smoke a cigarette to clean us out"
"current","i should be vaping right now"
"current","i should get my cigs around 12 30"
"current","I sit beside my bed hairy gut drooping above Minion pajama bottoms vaping convinced of the suffocating isolation which confronts us all"
"current","I smoke a lot of cigarettes for a landless man"
"current","I smoke and keep it mello"
"current","I smoke cigarettes to state my position clearly"
"current","I smoke cigs too"
"current","I smoke e cigs but still ("
"current","I smoke entirely too much"
"current","I smoke hookah btw Nothing else lol"
"current","I smoke my pain away lol"
"current","i smoke rothmans more than i think i does because ion keep count"
"current","i smoke the hunger away"
"not-current","I sneak out to a rooftop to smoke a cigarette at an urban party a quirky girl shows up and starts to talk to me Me ugh"
"current","I spent way 2 much money on vapeing shit But its like a 24 7 CIG and 24 7 dab hit"
"current","I stay coughing my lungs out cause of this cough but still with them smokes fml"
"current","I sure hope my orders from -MENTION- and -MENTION- ship soon I'm ready to get off the smokes"
"current","I swear I got everyone smoking blacks now"
"current","I think a hookah sesh is in order"
"not-current","I think being kicked out a smoking for laughing too loudly literally sums up me and -MENTION-"
"current","I think by the time i finish intern my intake of ciggs will be reduced to 50"
"current","I think I eat an actual meal as often as I go out and smoke"
"not-current","I think I just smoked too much"
"current","I think I need to vape again"
"not-current","I think I replaced smoking with coffee so I replaced nicotine for caffeine"
"current","I think i smoke too much now"
"current","I think I'll go burn a cig or five anyone wanna come"
"current","I think I'm in love w a juul"
"not-current","I think it's saw t say I've kicked cigarettes for good with this doosh flute #vape"
"current","i think my mom found my cigarette i'm gunna kms"
"not-current","I tried smoking a cigarette once Made me puke Dunhill lights thi I guess"
"current","I try not to smoke at all but the way it soothes my restless mind"
"not-current","i use to drink amp smoke so much as my escape"
"current","I used to fantasize about being in a three way Now most of my fantasies involve cigarettes"
"current","i vape"
"current","I vape so my lungs can see the clouds I'm about to blow"
"not-current","i vaped at a stoplight and ""vapenation "" was shouted at me im just tryna quit cigs man #endthestigma #vapelivesmatter"
"not-current","i vaped on the junebug it persisted"
"not-current","I vaped today and now I'm questioning myself as a person"
"not-current","I vaped tonite am I a woman now"
"current","I wana go to a hooka lounge"
"current","I wanna go smoke but all my friends too busy for me"
"current","I wanna smoke but my beds too comfy to get up #TheStruggle"
"current","I wanna smoke my hookah but my ass too lazy to get up and make it"
"current","I want a damn #cigarette case to put my smokes in that wont let em move around So when I open it half my #tobacco isnt loose"
"current","I want hooka right now"
"current","I want to go to a resort somewhere in Dubai and smoke shisha with my boo while watching the sunset"
"current","I want to smoke hookah so bad"
"current","I wanted to smoke a cig and cry in the privacy of my own backyard but someone is fixing my fence"
"not-current","I was dancing and I vaped an existential fox"
"not-current","I was vaping and I vaped a rave trans woman"
"current","I wish dan would move out here we'll be somewhere eating amp or smoking right now"
"current","I wish I could enjoy this cigar but it's too damn windy outside right now"
"current","I wish I was fuckin' sick enough to hit a Juul in lecture"
"current","I wish my friend would wake up I'm trying to smoke"
"current","I wish some company to coffee cigarettes and deep talks"
"not-current","i woke up this morning with a lot of pasta sauce on my shirt and 0 cigarettes"
"current","I worked 6 hours and forgot how to smoke a cigarette Try not to fall in love with me"
"current","cigarette and then putting myself to sleep again some how"
"current","hookah really does give me a headache"
"current","Time to settle in for the evening with my #coffee and #cigarettes buy some #porn and jack off Lust is good"
"current","I'd like sell my soul for a cigarette rn"
"current","i'd rather keep vaping instead of smoking cigs"
"current","I'd sell my dog for a cig right now"
"current","I'll attempt sleep after this hookah die out"
"current","I'll be here vaping"
"current","I'll be smoking a cigarette in front of the movie theatre at 7 o'clock"
"current","I'll be vaping under the stars and that's cool too I love my nugget"
"current","I'll figure my life out sooner or later but for now I'll just continue to lay low keep quiet and smoke in peace"
"current","I'm about to break down and order hookah"
"current","I'm back in the cigar smoking game"
"current","I'm bout to smoke and go to bed this sleep should be great since I ain't gota work in da am"
"current","I'm crying and chain smoking cigs bc there's ants in my kitchen and I'm SCARED"
"not-current","I'm done smoking"
"current","I'm done smoking til my birthday then I'm done after that for good"
"not-current","I'm done with smoking period"
"current","I'm eating baba ganoush and drinking mango juice and smoking hookah and cigarettes AND I'm alone so I basically feel heavenly"
"current","i'm eating chocolate chip cookies and smoking a cane mint hookah and it tastes exactly like mint chocolate chip ice cream"
"current","i'm getting my nails done while smoking the juul and i feel like a bawwwsss"
"current","I'm gone break down this cigar puff puff no passing"
"current","I'm gonna quit smoking cigarettes Until the prices go up"
"current","I'm having shisha alone I ordered the wrong flavour I wana crtyyhg"
"current","I'm here to just smoke a cigar and watch the flame grow"
"current","I'm in ocean drive smoking big 50s wit da top down"
