"labels","text"
"current","i'm in the hot tub smoking w my feet up"
"not-current","I'm jus now cleaning up from spring break there's so many cigs and beer cans on my balcony"
"current","I'm just coolin at Carmens tryna make something to smoke out of"
"not-current","i'm just kidding i actually vaped to find out next on Disney Channel"
"current","I'm just laying here wanting a cigarette but joe is passed the fuck out with one leg and one arm over me"
"current","I'm just sitting here Doing what I do Smoking on a big fatty vape"
"current","I'm just smoking Ports chilling on da porch"
"current","I'm just trying to hookah"
"current","I'm just tryna piss and have another cig or two"
"current","i'm just trynna get drunk get tats and go to the hookah bar"
"current","I'm just vaping on my ex bitch"
"current","I'm loving my hookah pen right now"
"current","I'm most m relaxed with a cig in my hand my sketch book out in front of me with a cup of coffee"
"current","I'm not going to bed till the battery dies on my eCig #thuglife"
"current","I'm officially a poor person rolling with drum tobacco"
"current","I'm on a cigarette diet right now But instead of trying to lose weight I'm just trying to kill myself"
"current","I'm on my first break at work and I'm sitting in my car smoking and this jackass just parked so close I can't get out of my car"
"current","I'm out here amongst the trees with new music smoking a cigar This is vacation"
"current","I'm out of cigarettes"
"current","I'm out of cigs Would it be weird to smoke a cigar It's my only option"
"current","I'm out of smokes sos"
"current","I'm outside on the porch smoking and I sware I hear like every animal out here right now Wtf is going on"
"current","I'm really out here smoking a cig while it's raining"
"current","I'm really playing darts right now in the middle of my living room smoking a cigarette"
"not-current","I'm sick lost my juul already"
"current","I'm sitting by my pool drinking a nice Brunello and smoking a Cuban Live better work""UNION"" I say"
"current","I'm sitting here drunk af thinking about how bomb a cig n coffee will be in the morning lmfao"
"current","I'm sitting here in the bathroom smoking a cig listening to youtube and the radio at the same damn time Feeling blessed"
"current","I'm sitting in a casino bar enjoying a cigar and a beer while writing in my idea journal Not gambling makes me feel so mature #Magic"
"current","i'm sitting in my car smoking a stoge bc it too cold n windy for me and i fucked up by wearing shorts"
"current","I'm sitting on a wet lawn chair #smoking"
"current","I'm sitting outside @ work smoking a cig and trying to not cry which isn't going well"
"current","I'm sitting right between two boys amp two girls amp I'm smoking the tobacco pipe with the guys amp talking makeup with the girls SIMULTANEOUSLY"
"current","I'm smoking a cig and going right back to sleep"
"not-current","i'm smoking a cigarette at 1 am and this drunk homeless guy said ""shaka bro "" as i walked by and i gave him a cigarette"
"current","I'm smoking a cigarette at work because my stomach hurts"
"current","I'm smoking but no butt rubbing"
"current","I'm smoking right now"
"current","I'm sneaking eating Doritos at the hookah lounge"
"not-current","I'm so bad at adulting today that I accidentally just mixed banana and absinthe e liquid together Surprisingly it's not terrible"
"current","I'm so good at smoking virtually with my ballpoint I deserve a cigarette"
"not-current","I'm so happy I'm not craving cigs"
"current","I'm so mad at myself for just throwing my juul across Krista's yard will be missed ("
"current","I'm SO READY to call my GP at 8 I have tea planned a cig ready the phones on charge I may only have one eye but I'm GETTING A DAMN APPT"
"current","I'm so tired I lit the wrong end of my cig -MENTION- im the one u write ur songs about"
"current","I'm sorry but I can't pay for my chain smoking cigarette addiction with ""exposure"""
"current","I'm still up and tryna smoke Hmu if u with it"
"not-current","I'm taking such good care of my body and mind lately I don't smoke cigarettes anymore I don't drink any type of alcohol anymore"
"current","I'm the type of person that preaches good vibes and energy while lighting a cigarette"
"current","I'm the type to do my hair and get dressed just to sit on Snapchat smoking my hookah"
"current","I'm too lit and I'm bout to spark this hookah with my lil brother"
"current","I'm trying to go somewhere in STL with bottomless mimosas and hookah"
"current","I'm tryna go to a hookah bar"
"current","I'm tryna go to the hookah lounge later"
"current","I'm tryna look at a nice view of the bay and smoke my Cuban cigar"
"current","I'm tryna smoke already"
"current","I'm tryna smoke cigarettes take a drive and listen to Mac DeMarco"
"current","I'm tryna smoke lol"
"current","I'm tryna smoke n sip in peace but it sound like somebody out here dying"
"current","I'm tryna walk out in a beater with a floral pattern shirt unbuttoned with Cuban link and a cigar in my mouth today"
"current","i'm vaping am i cool yet"
"current","I'M VAPING LOOK AWAY"
"current","I'm vaping while holding back tears this is the most tragic night of my life"
"current","I'm vaping with anger"
"current","I'm watching superbad while smoking a cig and drinking coffee a good start to the morning"
"current","I'ma slip into these pj's smoke this cigarette and knock out Bedtime really is my favorite time"
"current","I've a morning ritual of watching an episode of narcos while smoking a cig and a cup of coffee beside my candles"
"current","I've been sleeping later I've been breathing stronger I've been smoking deeper but the memories won't stop A TUNEEEEE"
"current","I've been trying to refrain from drinking and smoking but I keep having dreams where that's all I do"
"current","I've decided to give up gloving to pursue a new flow art called vaping"
"not-current","I've fully missed sitting out front on my steps and smoking cigs and reading and not freezing my ass off"
"current","I've gotten to the point where I can tell my constant cigarette smoking is causing me to look older than I actually am and that's terrifying"
"current","I've made a lot of stupid decisions in my life but the one I regret the most is getting hooked on smoking cigs"
"not-current","I've smoked so much today"
"current","I've started feeling better within myself but started smoking more cause I'm moodier and stressed lol"
"current","I m smoking to escape the distant memory of us"
"current","Idk where I am but I'm in a strip club chillin w the owner smoking a cig"
"current","idk why but I hate smoking in my car now"
"current","Idk why vaping is so satisfying but I love it"
"current","If anyone wants to go to sheeshas tonight then hmu"
"not-current","If anyone wonders why I'm cranky no cigs in two days no whiskey Barely any alcohol and more work than usual don't judge me"
"current","If cigarettes don't kill me than over thinking probably will"
"current","If food liquor and hookah are there count me in"
"current","if i smoke a cig off a pill does that make me tar xan"
"current","If I vape while I'm sick rn will I get bored so easily"
"current","If I vape while I'm sick rn will I get those goosebumps every time"
"current","If I vaped anymore I think I'd end up being called nicotine"
"current","If my enemy is a fire it only burns my cigarette"
"current","If someone wants a Juul ecig you can have it for 40 I just bought that bitch today but want a g pen instead"
"current","iLight my cigg lol"
"current","im a vape god"
"current","Im about chain smoke this whole pack"
"current","Im actually in the mood for hookah"
"current","Im at archers smoking area anyone should drop by and say hello ik extra friendly"
"current","Im bout to pull up on the block and bring the hookah outside and bump el Alfa"
"current","Im eating icing and vaping trying to makes o's #I nsomniACa suckit"
"not-current","Im finna quit smoking frfr"
"current","im going thru a crisis listening to gucci mane vaping life is guhhhd"
"current","im here to respect women and smoke cigarettes but im already out of cigarettes"
"current","im in vapeing heaven and have achieved nirvana"
"current","Im just kickin my shit just cooling bout to smoke another O"
"current","Im just trying to smoke and not feel shit"
"current","im just vaping right now profusely"
"current","im sitting in the mothrrfucking dark and smoking"
"current","im smoking one got another one"
"current","Im so craving to vape on right now ogoshhhhhh"
"current","im standing outside drinking wine out the bottle n smoking a cig in a silk robe i am tht bitch"
"current","im tryna vape"
"current","im vaping 1 of the new flavours cool mint if u like menthol type flavour this is a good 1 not to overpowering either )"
"current","im vaping w my mom huh"
"current","im waiting to drop either my phone or my juul in the tub currently"
"current","Ima put a hooka in the crib already got the Bluetooth speakers with some drank i might not ever leave the spot if it ain't about or"
"current","Ima sit here w my hookah and listen to Take Care until I'm not disappointed anymore"
"current","Ima smoke Ahh cig finish my old coffee an shower"
"current","Imma just stick to smoking"
"current","in a jet is where my mind is so i light another cigarette to calm me down"
"current","In a jet is where my minds at so I light another cigarette to calm me down"
"current","In a pub with British American Tobacco"
"current","In need of a cigarette"
"current","in need of ciggs and alcohol rn"
"current","In other news no cigs at work Home is another matter Baby steps"
"current","In pajamas and my beaten to shit 750s drinking tea and smoking a cig on my balcony"
"current","In the ATX got my pack of cigs ready to hit 6th"
"current","In the car smoking my Pura soul cigar"
"current","In the hookah bar falling asleep"
"current","In the mood for a nice cigar"
"current","inhales two cigarettes in hopes of shortening my miserable work life"
"current","Ion eat unless I smoke"
"current","Ion even feel like smoking that's how aggravated I am dawg"
"current","is anybody near MCAD right now and has cigarettes like im for real lol"
"not-current","Is it normal for shisha to make e feel mwi am absolute mash man"
"current","Is it wrong of me to crave a cigarette so bad"
"not-current","It started with shisha Ended with my stupidity"
"current","It will be nearly 50 degrees this weekend in AK I get back from the field Thursday This will be a cigar and gun filled weekend"
"current","It's 1 00pm and I'm smoking hookah"
"current","it's 10 18am and i am craving a cigarette and an entire bottle of wine on a warm porch"
"current","It's 2 pm and I'm barley having my coffee and cigarette smh"
"current","It's 2am on a school night and lauren and I are drunk at the hookah bar"
"current","It's 4 P M on a Monday and here I am on the back patio feeling my Pinot Grigio buzz already in a camo robe enjoying a cigarette"
"current","It's 4am and I'm tryna talk myself out of driving for cigarettes"
"current","It's 5 am and I'm just eating and smoking"
"current","It's 5 o'clock pig Time for a white wine and a cigarette"
"current","It's 5AM and I'm sipping decaf and smoking a cig"
"current","It's 6am I'm sat in the cold alone smoking so if anyone wants to be my mate hmu"
"current","It's almost 10pm on a Thursday Not gunna lie I feel pretty rebellious being on my patio w a beer and a cigar"
"current","It's ALMOST too cold for a cigarette outside Almost"
"current","It's always been usual for me to watch football game and sheesha with 8 guys (Habibi's friends)"
"current","It's an ice coffee and 2 cigar evening"
"not-current","It's been nine days now without a cigarette"
"current","it's cold but i like stars so im gonna sit out here and smoke 10 cigarettes"
"current","It's impossible for me to smoke w o having a water bottle likes I needs that"
"current","It's past 4 20 shit imma smoke 1 more brush my teeth and sleep on the couch cause All my clothes are on my bed"
"current","It's really 5 30 am and I'm up smoking hookah with my dog watching cats and dogs I'm officially washed"
"current","It's snowing and I'm vaping rosin"
"current","it's snowing and im standing outside in shorts smoking a cigarette"
"current","It's so beautiful out Good night to hookah"
"current","It's so cold smoking a cigarette is miserable"
"not-current","It's so weird how I used to smoke party amp drink sm amp now I can barely take shots haven't smoked in months amp go clubbing shows more"
"current","It's time for a cig my nig"
"current","it's time for the daily ""I'm so fucking bored at 2pm in the afternoon what the fuck am I doing with my life"" cigarette"
"current","It's times like these I wish I had a damn cigaret"
"current","It's times like this when I'm doing React development on a Macbook using an e cigarette that I wonder when I became such a fucking hipster"
"current","It's to cold to be smoking a cig in a t shirt"
"current","it's vape time let's have fun #vape #vaping #vapor #vapefun #pipe #smoking #ecig #cigarette"
"current","ITS LIT MY MOM GAVE ME THE GO TO SMOKE HOOKAH IN MY ROOM"
"current","ive never needed a cigarette more in my life and i cannot even have one"
"not-current","Js somebody almost lit my finger instead of mu cig"
"current","jus thinking about maybe I'm drinking and smoking too much lately and I using it to cope with stuff"
"current","jusko stress pls don't let me smoke another pack smh"
"current","Jussszz me in panties n vaping lol gunnite"
"not-current","just a tip don't eat Takis then smoke a cig ur throat will burn amp it is not enjoyable"
"not-current","just beer no more ciggs"
"current","Just begins calmly smoking a cigar on the TL"
"not-current","Just bought a soft pack of cigs Is this the 90's"
"current","Just getting home Shower Hookah amp A Glass Of Wine"
"current","Just getting off work and need a cigar but all these fucking stores close at 12am"
"not-current","Just got a warning for vaping in a non smoking room"
"current","just got hit by a car walking but the guy gave me a cigarette we cool"
"current","Just laying on the floor smoking hookah in my empty room I love my roomies"
"current","Just lit the wrong end of my cigarette and now I'm dying"
"current","Just lit the wrong side of my cig for the first time in my life and I feel so ashamed"
"current","just made direct eye contact with my neighbor while I'm smoking a cig out my window w a face mask on amp towel on my head gmorning"
"current","Just need to smoke and talk"
"not-current","Just over two weeks smoke free #NoSmokingDay"
"current","just painted my nails gunna smoke a cig i'm chillin"
"not-current","Just plugged in 3300mah #ecig battery I #vape d 1855 puffs at 6 5w over 40hrs (down time not subtracted)"
"not-current","Just remembered -MENTION- dropped the fucking hookah on the homie lmao"
"not-current","just sent my mom pics of me smoking hookah welcome to adulthood )"
"not-current","Just smoke my ecig in front of the no smoking sign then flipped off the mall cop"
"not-current","Just smoked so I can smoke"
"not-current","just smoked feeling good"
"current","Just smoking a cigar by the ocean it's fine"
"current","just talking over cigarettes and drinking coffee"
"current","Just talking over cigarettes and drinking coffee"
"current","just tried to grab my cig out my mouth to toss it and str8 ripped the cherry off with my fingers"
"current","Just tried to light my cigarette with a Chapstick"
"current","Just used my torch to light my cigarette lol"
"current","Just vaping and daydreaming"
"current","Just woke up for a cigg' and saw myself in the mirror ndi ya shisa yaz' that why ndi jola nou di laas"
"current","kfc coffee and ciggs"
"current","Kids asleep reading comics smoking a cigar on my patio while listening to TLC Weird evening"
"not-current","Kinda miss beer and cigarettes But im still having a good time with smoothies and homemade baked goods"
"current","laid back smoking shisha i'm in heaven"
"current","laiddd back chilling smoking never worried"
"current","Lat cigarette I hate life right now"
"current","Late night smoke session wit my fine ting"
"current","Late night smokes are one of the best"
"current","Lately I'm smoking more but I'm focused more"
"current","Laying back listening to #TREMAINETHEALBUM w this hookah flowing and this red wine"
"current","Laying in bed fresh out of the shower naked listening to jazz and smoking a cigarette"
"current","Laying in bed naked smoking a spliff"
"not-current","Left my home w a dream n a cigarette"
"current","Legitimately so miserable that I'm smoking a fucking cigarette @ work rn"
"current","let me smoke cause"
"current","let me take this late nite drive and jam out hit the hookah and clear my mind"
"current","let's all hang out and discuss our vape tricks )"
"current","Let's go smoke sum sheesha we out in clapham tonight bitches will be going live on instragram around 8 or 9pm"
"current","Let's go to hookah"
"current","Let's hit the hookah bar"
"current","let's just smoke and listen to -MENTION- and -MENTION-"
"current","Let's light a cigarette and enjoy this night"
"current","Let's Smoke amp Lay Up"
"current","lets smoke #sochill"
"current","life is too short not to smoke cigarettes"
"current","Light me up a cigarette and put it in my mouth You're the only one that wants me around"
"current","Light me up a cigarette and strap shoes on my feet"
"current","Lighting match sticks to light my cigarette sticks hahaha yey"
"current","Lights a cigarette up and starts smoking On the bench"
"current","Lights a cigarette ""Here's to another night of nightmares """
"current","Lights yet another cigar This is starting to become a problem"
"current","Like i really rather just be in my zone gettimg money and smoking"
"current","Lil sublime and a cigarette under the stars"
"current","Link at the Hooka in east town 8 30"
"current","Listening to AC DC n smoking Marlboros"
"current","listening to Freak amp smoking a cigarette outside of the local liquor store"
"current","Listening to happy hardcore and writing a Russian paper while smoking quality hookah Yus"
"current","Listening to music and hitting an e cig is the best feeling ever"
"current","listening to panic @ the disco at 2 am in my bed alone smoking a cigarette"
"current","listening to whitney smoking a cig wearing skinny jeans and a flannel ive done it folks i've reached peak hipster trash mode"
"current","Listens to Mac DeMarco while smoking a cig"
"not-current","Lit a cig n accidentally dropped it in the snow walking up stairs"
"current","Lit my cig backwards Yum"
"not-current","Lit my cigarette too close to my face and burnt my facial hair"
"current","lit the wrong end of the cig just like -MENTION-"
"not-current","Literally haven't vaped in forever saw the SV Mi One and fell in love all over again ITS SO MINI AND CUTE #Vapenation #vapefam #vapelife"
"current","living off cheap cigarettes and cheaper vodka"
"not-current","lol i hit a vape once and my friends ignore me"
"not-current","LOL I WALK ALL THE WAY INFRONT OF THE BIN I FLICK MY CIGG MISSED COMPLETELY LOL FUCK"
"current","Lol my parents would rather me smoke inside my house than outside in my car not complaining though"
"current","Lol this month pay from saf not even enough to buy one packet of ciggs siao liao lor everyday white rice soy sauce liao"
"current","Lone Star Hoolahs having a car meet starting at 12 Swing through for some nasty hip hop and hookah and carssss"
"current","look at this cool vape trick"
"current","Looking forward and bit excited to my 1st vape Lol"
"current","Lost my ecig and I'm going insane"
"current","Lost my juul how do I relieve my stress"
"current","lost my whole unpack cigg somewhere amp somehow"
"current","Loud music and fast cars puffing on ma cigar"
"current","Love coughing up a lung and then immediately smoking another cig"
"current","Love having my own house I can smoke a cig in my living room naked"
"current","Love love love my new Vape"
"current","Love the Vype Pebble"
"current","Lowkey wanna go to a hookah lounge"
"current","lulu can you teach me how to vape"
"not-current","Mad af I lost my fone at the hookah bar"
"not-current","Mad went to go set up my hookah amp amp amp I have no coals tragic"
"current","Made it to Japan after a 10 hour flight I need a smoke"
"not-current","Made my homework and I'm proud needed a cigarette doing it because of the stress but I made it"
"current","man it's cold as fuck I wish I was laid up watching a damn movie Smoking on some hooka like I usually would be doin"
"current","man shes not ready im here at the entrance of the cave sweating needing a cig asshole clenched im too excite"
"current","Marlbies going up again Rollies now on #blahhh #cig #brokelife #groddy"
"current","maya told me i'm smoking to deal with my anxiety and depression YALLLLLLLLLL THIS GIRL IS COmpletely right help"
"current","Me goes for run while smoking cigs"
"current","me amp erik just sitting outside smoking like there ain't no damn storm lol"
"current","me and my juul make such a cute couple"
"current","me and my mama can argue then be smoking and drinking 30 mins later"
"current","me and this dude smoking a cigarette right outside my pharmacy are kindred spirits"
"not-current","Me doing hookah tricks ended up almost drooling on myself"
"current","Me tl in a kid dressed in full addidas vaping"
"current","Me Wenns and Damien deadass at the hookah bar hella dead but fuck it"
"current","Me takes cig break while working out"
"current","Me washes face and brushes teeth Me I want a snack and a cigarette"
"current","Me being judgey at the person in front of me in line buying lotto tickets Also me in line to buy a pack of cigarettes"
"current","Me god why won't this cough go away Also me smokes half a pack a day"
"not-current","Me okay what are some things we absolutely can't forget to bring to Miami Tori gum cigs chapstick #priorities"
"current","Mi mi da hookah live pineapple"
"current","might become one of these guys who instagrams himself outside in a chair wearing sandals and smoking a cigar with the hashtag ""#winning"""
"current","might've just had the greatest idea ever might just need a cigarette we gon find out eventually"
"current","Mint hookah clearin my sinuses up and shit"
"current","Mints cologne cigarettes and coffee"
"current","Missing my vape"
"current","Mister song cigg break"
"not-current","mmm spots #nosmokingday on my feed as i come back inside after having a cigg #forex"
"current","More Life top 5 albums while smoking hookah lmfao"
"current","More smoke less stress"
"current","Motherfuck I just kicked my hookah hose off the couch and broke the glass mouth tip chamber part GODDDDDDAMMIT man"
"current","Mountains of ash and clouds of smoke"
"current","Mouthfull of e liquid I think I'm gunna die"
"current","My AC on my ceiling cracked smoking killa"
"current","My aesthetic this weekend is sad Brad Pitt vaping and listening to Bon Iver"
"current","My allergies aren't set up for ANY type of smoking Well hookah I can do hookah lol"
"current","My aunts taking me to a hookah bar and to the casino for spring break"
"not-current","My baby spoiled me this weekend beer cigs a new phone HR trip party 2x in a row and the best of all sleeping in my bed"
"current","My bad habits are cigarettes coffee and boys"
"current","My bf left me so I'm smoking hookah alone sippin alone"
"current","my body runs on coffee cigarettes and hate"
"current","My cigar is burning slow"
"not-current","My cigarette just fell out of my mouth to the floor I guess I support islam and flinging a faggot"
"current","My cigarette smoke burned my eye and I just fell the fuck over out my chair god damn it"
"current","My diet is literally ice tea peach and cigs"
"current","My e liquid tastes like white wine and I'm triggered"
"current","my favorite cigarette"
"current","My favorite part about my first job is drawing and trying out new vape juices"
"current","My favorite pastimes are hookah wine and making depressing playlists"
"current","My friends all gettin engaged and havin babies and here I am eating brownies and smoking a cigarette in bed"
"current","My friends hookah and wine sounds about right"
"current","My gf just scared me so bad I literally cried and I like needed a cigarette cause that stressed me out"
"current","My grandma is trying to take us to a hookah lounge I ain't arguin"
"current","My homemade laxatives coffee adderall and tobacco"
"current","My Juul is officially broken lt 3"
"not-current","my lip makes me look like i've been in a fight but really i'm just an idiot who drunkenly tried to smoke the wrong end of a lit cigarette"
"not-current","my lips must really be turning black i don't even smoke anymore"
"current","My living room just became vape town"
"current","my main goal in life consists of me sittin' on the can with a 44"" HD TV on the wall all the wall smokin' a nice thick cuban cigar"
"not-current","My mom found out that I vaped and I was far from home I swear she has cameras everywhere"
"current","My morning ritual consists of smoking a cig while on the can then going back to sleep"
"current","my nails all fucked up from smoking"
"current","My neighbor just bummed me a cig god bless"
"current","My neighbor stay fucking me up with this hookah"
"current","My new client bought me a vape pen im tryna get use to it"
"current","My new favorite vape liquid ""Hot Rings"""
"current","my new juul and mango pods come in im so happy"
"current","My new vape came in the mail bless"
"not-current","my pack of marlboros said ""cigarette smoke produces carbon monoxide"" isn't that the shit that kills u if u inhale it oh OHHH"
"current","my room is filled with smoke ) (not fire)"
"not-current","My signature move in high school was smoking marlboros through my nose and running headfirst into metaphorical brick walls"
"not-current","My sister walked in on me and the homies smoking"
