"labels","text"
"current","dyou reckon i can give up ciggs for lent again after failing spectacularly this week because TECHNICALLY forty days starts here"
"current","hookah bar w it '"
"not-current","1 WEEK OF NO CIGARETTES FOR"
"not-current","on the sofa dead Woke up from a coma pulled up in a koda Smoked went back to bed"
"current","""A hamburger cigs beer and sitting on the couch in sweats and a t shirt My evening plans """
"current","""All I aspire to do with myself is blow bigger coulds and vape my life away"""
"current","""got a cat in my left arm and a vape pen in my right"""
"current","""heartburn why "" i ask finishing another cigarette and another cup of coffee"
"current","""Hey can I take a sip of your juul bro"""
"not-current","""I brought my hookah pen to a One Direction concert "" -MENTION-"
"not-current","""i had to load up i hadn't smoked in 4 hours"""
"current","""i know smoking is bad but my reason for smoking is worse """
"current","""I listen to kali uchis and raury smoke cigs take artsy pictures and Quentin Tarantino is my favorite movie director I swear I'm unique"""
"not-current","""i want to try mind altering drugs"" ""i vaped once"""
"current","""I'll vape to that"""
"current","""I've got the 'tinglies' this cig is sending me under"" -MENTION-"
"not-current","""I've had three cigarettes today one cup of coffee four Oreos and one chicken strip"" -MENTION-"
"current","""Im coming over to smoke a cig"""
"current","""im still an angel im just a vaping angel now"""
"not-current","""Security snatched my juul and now waiting to get suspended FML"" headASS"
"current","""What's wrong "" Me takes long drag off cigarette ""My sketchers just don't light up anymore """
"current","crosses legs lights cigarette and waits another 35 million years for the Submergence trailer to drop"
"current","i take a drag from my cigarette hirijihara's pretty boring but i'm here for asano my good girl the light of my life"
"current","@ The Hookah Bar"
"current","sipping this hot tea amp smoking this cig"
"current","Casually sits at a bar with a beer amp cigarette burning in an ash tray"
"current","coughs so hard i drop to my knees and vomit yeah i vape"
"current","does vape tricks in front of sanae"
"current","falls in love with a cigarette"
"current","forgets pack of cigs in another state me can you mail them to me"
"current","gets intense cough wow it's a great time to smoke some menthol cigs that'll definitely help me feel better"
"current","holds a cig in my hand me wow I feel sexy"
"not-current","remembers that time i lit a cigarette using the stove top and burned my hair"
"current","rolls eyes lights another cigarette"
"current","unplugs grandpas life support to charge my vape"
"not-current","waits patiently for Cindy Allen to freak out about the Blackbeard Cigar purchase on my debit"
"current","Time to eat Lasagna and smoke HOOKAH and play DBZ or watch RWBY"
"current","#authorconfession D2 coffee and my e smoke (I know trying to quit )"
"current","#clean murder mystery party where can i buy e cigs"
"current","#little bears child care where can i buy e cigs"
"current","#sat prep tucson where can i buy e cigs"
"current","#SheeSha #PeeeNa #A #Ty #JeeNa #A #DuNiYo #ChO #Ki #LeNa MiaN BiLaL ka ChAsKa drinking smoking shisha"
"current","#smoking #exwife webcam #abigail police #girl #clapping mexican"
"current","#vape so hard motherf ckers wanna fine me"
"current","#vaping in ATL airport bathroom AMA"
"current","#where can i buy e cigs disc degeneration nos"
"current","1 cig takes the stress away"
"not-current","1 day 2 packet cigg really gg"
"current","1 28AM Sitting outside listening to music and smoking a cigarette #littlethings"
"current","100 Retweets and I'll quit smoking"
"not-current","100 @ the hookah bar"
"current","13 for a pack a cigs you"
"current","1st i lost my almost full pack of ciggs Then i lost my phone But it got returned thankfully Then i hit n run a monkey(it survived)"
"not-current","1st we Hit Brooklyn with the cigs then we headed to more boroughs (Marlborough) NJT"
"current","2 A M Cig break #midnightmadness"
"current","2 A M Cig break #midnightmadness"
"current","2 in the morning and I'm still kinda weak again i smoke a cigarette and play another waiting game"
"current","23 00 Hookah Time"
"current","2nd im smoke a good 2 5 3gs in a -MENTION- swear i be in my Zone"
"current","3 Ciggs In 5 Mins Awesome"
"current","3 ciggs in one break hmm wonder if my adrenalines sky rocketing today haha"
"current","3 in the morning li'i is knocked out and I'm just vaping my life away"
"current","3 15 AM Alone time music cigarette and sky gazing"
"current","30 min break at work quality time w the juul"
"current","4am smoking a cigarette talking to my fav"
"current","5 years of cigarette smoking and still no rasp what am I doing wrong here"
"current","800 Retweets and I'll start smoking cigarettes"
"current","A cigarette and an ice cold beer would be perfect rn"
"current","A cigarette would be nice rn"
"current","a cigarette would be nice with this coffee"
"current","a cup of coffee and a cigarette please #Iwish"
"current","A nice glass of -MENTION- and a nice cigar would be amazing right now"
"current","A pack of cigarettes and smiroff will hit the spot"
"not-current","a stranger gave me cigg"
"current","A wild and crazy weekend involves sitting on the front porch smoking a cigar reading a book Robert M Gates #kindle"
"not-current","A year and 3 months clean from #Alcohol amp #Cigs #praiseBeToGod"
"current","I really needed to restock on bullets maybe I can get a few cigarettes while we re at it"
"current","About to go smoke since I'm up"
"current","about to smoke w my co worker than head home to my shower amp bed"
"current","About to watch this movie n blow this hookah"
"current","Aesthetic smoking a cig while on the treadmill"
"current","Aesthetic smoking a cigarette outside the court house with a tank top and pajamas on"
"current","Again wit the bestie shhhmokin hookah sippin"
"current","Ah yis smoking shisha with frineds is what a person needs sometimes #Saturday"
"current","all i do in my break is chug redbull and hit my juul"
"current","All I do is vape and eat pizza I am truly ashamed of myself"
"not-current","Almost a month and a half without cigarettes and it feels bomb af"
"current","Almost halftime for #Gonzaga -MENTION- game get to -MENTION- for a #cigar and the game on the patio #spokane"
"not-current","Almost one year smoke free go me"
"current","Already stressed out and realised i'm out of cigs Stressed out even more now"
"current","alright cig time i'm heated"
"current","Alright I'm trying to go from cigs to vaping but so far still just seems weird to me"
"not-current","also i lit a cig with a 1975 lighter today and it made me feel as tho i peaked as a Pretentious Indie Fuck"
"current","Also nothing beats smoking a cig in bed while watching a movie"
"current","Am I allowed to smoke cigs in my dorm #ReplyTweet"
"current","am I late to this Diet Cig party"
"current","And at the end of the night it's only music cigarettes in the darkness of four walls loneliness and myself #goodnight"
"current","And by productive I put on a face mask and have a cigarette That's productivity to me"
"not-current","And i just threw my vape away"
"current","And I love me some marlboros lol"
"current","And my vape already taste like coal"
"current","And on that note i have to go smoke"
"current","And still sitting here (my vegetables are still in the kitchen)drinking coffee and smoking cigarettes dam I'm fucking tired"
"current","Any suggestions on good bar cigar bar spots Possibly with a kitchen that's open late"
"current","Any1 in col wanna come for a cig break lol"
"current","Anyhow I'm celebrating cigar and White Remy UNC won different V new life coming"
"current","Anyone know where I can get shisha tobacco in Ealing Ta"
"current","Anyone tryna smoke this evening"
"current","Anyone wanna smoke rn I'll pick you up ("
"not-current","Anytime a Buckcherry song comes on I'm instantly back in middle school sneaking cigs out my window trying to be the most tragic person #tbt"
"current","Smoking reading the Bible listening to more life"
"current","Arturo Fuente Curly Head Deluxe Yes please Just puffed one up so nice Smooth mild and nutty #cigar #herf #Portland"
"current","As bad as it is a cigarette before bed always calms me"
"current","As I smoke a cigar in Napa valley while waiting on room service I realized #LifeIsGood"
"current","At 'the hatter' a bit worse for wear and smoking cheap cigarettes yeahhh boyeeee Lol"
"current","at Fog Hookah Bar"
"current","At meineke with an ice cream and cigarettes"
"current","At one point I would get offended if a cashier carded me for cigarettes but now I just take the compliment"
"current","at school i'd reward myself for hitting certain word counts with sweets and now it's moved onto cigarettes i love evolution"
"current","at the hookah bar like I ain't got work tom ("
"current","Attempting to pluck my eyebrows while smoking a cigarette"
"current","Awesome potato chips sleep fast cigarettes soon"
"current","Ay bro u mind if I hit ur juul mine ran outta juice"
"current","back at it again w the crying while listening to brand new outside smoking cigs"
"current","Back on the vaping ting"
"current","Back porch coffee cigarette peace"
"current","Back to my wine and cig nights I'm feeling fucking fancy"
"not-current","Basically got paid to smoke cigarettes and play 8 ball pool today"
"current","Beach hookah"
"current","because im sick im drinking pineapple juice instead of coffee while smoking"
"current","been shamefully watchin friends and smokin cigs in my room all night and every time i light a cigarette chandler pulls one out"
"current","Beer 'n cigar o'clock"
"current","Beer and hookah"
"current","Beer in one hand cigar in another and no limit at the table #casino #14"
"current","Beer pizza a littlr bit of smoke plus some -MENTION- on the speakers my Saturday night #capebreton #mylife #cbd"
"current","Being an adult is smoking a cigarette and drinking out of a juice pouch at the same time"
"current","Between the shite diet the smoking and the regular sleep deprivation am probably set to look about 50 by the time am 23"
"not-current","Beyond happy i dont smoke cigarettes anymore"
"current","BlackFriday BlackFriday is too good for me because i used electronic cigarette which i missed a lot"
"current","Blowin hookah listening to good vibes"
"current","Blueberry mint hookah amp an L Wake amp Bake lit"
"current","Bottle of wine and a cigar life has a meaning"
"current","bought my 1st #ecig bc there's in new #house commune I'm livin in Been thinkin ab switching to #vaping anyway so I'll c how this goes"
"current","Bought some wine amp a personal henny amp got my hookah My Thursday"
"current","Bout to relax and smoke Who should I listen to"
"current","Bout to sip Dusse and smoke hookah and hopefully play 2k"
"current","Boutta Start Smoking Cigarettes"
"current","Boy I can't w8 to vape hydrogen cyanide"
"current","Bring cigs to 67th"
"current","Bring me a cig plz"
"current","Bring me a cigar I'm in the burg"
"current","bring me cigs if you real"
"current","Bring us cigarettes or booze SOS"
"current","Bubbly amp hookah w -MENTION-"
"current","Bumpin earl sweatshirt smoking cigarettes till my chest hurt"
"current","but am still friends with a Vape pen hanging out"
"current","but first i need to go to the liquid store to buy new liquids for my e smoke"
"current","but honestly chillen on my roof smoking sounds much better rn"
"current","but i need money for cigarets"
"current","but i need money for cigarets zzzzzzzzzzzzz xxxxxxxxxxxxxxxxxxxxxxxxxxxxxxxxxxxx"
"current","but I promised to go to hookah"
"not-current","But I tried this mint flavor OMG I b wanting to smoke hookah erryday now"
"current","Can I just be home with my pipe in bed smoking"
"current","CAN I SMOKE IN PEACE NOW FOR THE LOVE OF JEON"
"current","Can someone drop me a pack of cigarettes pls"
"current","Can someone find me some blackberry peach vape juice"
"current","can someone get me a pack of cigarettes"
"current","can someone pls buy cigarettes for me i is broke"
"current","Can someone recommend me good food place with shisha too please thanks xx"
"current","Can't be wit me if you don't know how to set up the hookah"
"current","Can't breathe too much alc ane cig"
"current","can't find my ecig and I'm about to start throwing shit"
"current","Can't just be me that thinks sterling menthols are the tackiest cigs going"
"current","Can't sleep watched rise of the foot soldier already might as well stick on nmb2 #insomnia #sober #vaping #aspire"
"current","Can't sleep I need a cigarette so bad but don't wanna go out in the rain and I refuse to make my lil girl a victim of secondhand smoke"
"current","Can't smoke w anyone who holds the smoke in they mouth like a bitch"
"current","can't wait to be able to buy my own cigarettes and give myself lung cancer"
"current","Can't wait to get back to the pad set up the hookah and bump the new Mike Will Trey Songz Goldlink and Raekwon"
"current","Can't wait to smoke this bluntt"
"current","Can't wait until I can smoke again"
"current","Cant beat a shisha and a mint tea to wind down"
"current","casually smoking a cigar using the restroom i'm actual goals"
"current","Casually standing outside in my boxers and flip flops smoking a cig"
"current","CATCH ME IN MY BACKYARD SMOKIN HOOKAH AND CRYING TO MADIBA RIDDIM ALL SUMMER 17"
"current","Caught a plug caught a play time 2 smoke again"
"current","cause I'm a whiskey drinking fight provoking cigarette smoking dude I got a problem with my attitude it's hard for me to keep cool"
"current","cause I m a whiskey drinking fight provoking cigarette smoking dude I got a problem with my attitude it s hard for me to keep cool"
"current","Cause of all the latest shit i become addicted to cigarettes But it's actually beautiful"
"current","Chain smoking"
"current","Chain smoking at 1 am"
"current","Chain smoking cause I'm stressed"
"current","Chain smoking cigs by myself What else is new"
"current","chain smoking cigs to make myself feel better"
"current","Chain smoking coz why not I'm stressed as fuck"
"current","Chain smoking in the whip it's hard to breathe"
"current","Chain smoking till my lunges collapse"
"current","Cheering on Team USA in the WBC with Dunbarton Tobacco amp Trust Mi Querida Ancho Largo"
"current","Chewin up my cigarette and smokin my gum"
"current","Chillin at the hooka lounge and played -MENTION- pump it up and that shit still go"
"current","Chilling at the hookah bar getting faded"
"current","chowess' gf looooves cigarettes"
"current","Cig and coffee mode"
"current","Cig break"
"current","Cig cravings are strong today"
"current","cig n coffee n hug would b nice"
"current","Cig then taking advantage of Kaia sleeping and letting myself nap"
"not-current","Cig Finish cleaning then maybe bed What is sleep tho Jk Ha"
"not-current","Cigar and cigarette ashes As I open all my luggage up"
"current","Cigar on the front stoop Listening to some older Gaslight Anthem tracks Casanova Baby"
"current","Cigar run but the rain smh"
"current","Cigar time"
"current","Cigar time"
"current","Cigar time with a coat Just winter"
"current","Cigar time with a coat"
"current","Cigar time"
"current","cigar wine amp dominoes sunday funday"
"current","Cigar Cognac ""Trouble Man Heavy Is The Head"" album all while sitting on my front porch #LifeIsGood"
"current","Cigarette in my pocket I think that's a problem"
"current","Cigarette time"
"current","Cigarette time is the right time at night time in my time xx"
"current","Cigarette to erase the stress"
"current","Cigarettes amp Cush #Merky"
"current","Cigarettes and cheap coffee"
"current","Cigarettes and coffee and whiskey #itsawrap"
"current","Cigarettes and coffee r my favorite thing in the world"
"current","cigarettes and jazz music very much needed rn"
"current","Cigarettes and trucker hats my Saturday nights"
"current","cigarettes for breakfast"
"current","Cigarettes make me poop too"
"current","Cigarettes on cigarets my mama think I stink"
"current","cigarettes rainy nights and existential dread"
"current","Cigarettes sun block and cheap liquor"
"current","Cigg break"
"current","cigs over food"
"current","Cleaning my house is also an activity I didn't know I enjoyed Cleaning while jamming while smoking then sleeping Bliss"
"current","Cleann apartment smoking and waiting for my baby to bring me home my friendlys"
"not-current","Coffee amp cigs ain't sittin too well this morning"
"current","Coffee and a cig wake ya up but make ya shit"
"current","Coffee and a cigarette for me milk and a granola bar for baby Adventure Time for wifey and sleep for Daddy #polyparenting"
"current","Coffee and cig"
"current","coffee and cig"
"current","Coffee and cig while waiting on my truck happy Saturday"
"current","coffee and cigarette"
"current","Coffee and Cigarettes are best when shared with you"
"current","Coffee and cigarettes are my guilty pleasure"
"current","Coffee and cigarettes at 2pm counts as breakfast right"
"current","Coffee and ciggs smell phenomenal together"
"current","Coffee and cigs would be perfect right now (((("
"current","Coffee stained lips and cigarette stained fingertips in summer"
"current","Coffee a cigarette and a good book"
"current","Come to the hookah lounge"
"current","Considering smoking just so my ass won't hurt as much just so I can ride my bike somewhere to smoke lmao"
"current","Constantly smoking sipping and stitching NoSleep"
"not-current","Could have lit the hooka on my break too smh"
"current","Craving for a cigarette"
"current","Crib turned hookah bar"
"current","Current mood listening to alomar in my garage smoking cigarettes and trying to write music"
"not-current","Currently having flashbacks to smoking hookah with -MENTION- in some random dudes basement An interesting night"
"current","Currently sitting naked on my bathroom floor smoking tobacco from a pipe"
"current","Currently smoking a cig outside of Hardware alone #loser #help"
"current","Currently smoking shisha"
"current","currently so happy because my besties and i just got our hookah"
"current","currently vaping my life away"
"current","Cuttin liquor an tobacco out of my life"
"not-current","dam this cig buzz got me fukd up"
"current","Damn Bitch I can't even smoke a cigarette cause mfks think I'm doing voodo TF"
"not-current","Damn hookah made me light headed"
"current","Damn I've been coming home from work smoking and knocking out then waking up early af"
"current","Damn my cousin is really a snake for telling my mom I smoke hookah like mind ya shit bitch"
"not-current","Dania comes over we smoke have some good laughs now I'm schleep"
"current","Dark liquor and cigar smoke"
"current","Dave reaching for a cigarette all night lmao"
"not-current","Dawg I just tried to vape and I couldn't take myself seriously I just busted a gut I can't"
"not-current","Day 8 off the ciggs This shit is easy haha #LifeGoals"
"current","Deadass bout to watch scandal and smoke my face off"
"current","Dear some one take me to #Hawaii so that I can vape w the -MENTION- familitty #nodiggity #nodoubt"
"current","Debating on hotbocing my car w this cig so I don't have to stand outside in this cold"
"current","Deep convo amp Good smoke"
"not-current","Def just went for a drive and smoked almost an entire pack in an hour"
"current","def wanna work on quitting smoking"
"current","Definitely almost just walked into the dorm with my lit cig"
"current","Definitely cigar time lol"
"current","Devon told me there are 18 empty packs of cigarettes in my car oops"
"current","Dinner wine and hookah"
"not-current","Dinner coffee hookah pool My study night lol"
"current","Dip and cigarettes are huge turn offs for me"
"current","Do I get a new vape or nah"
"not-current","Done smoking"
"not-current","Done smoking for a while getting back with the flow of the basketball"
"current","Donnas trying to teach me how to roll cigs n it reyt int working out n am just getting angry"
"current","Drakin and smoking right now haha #IfYoureReadingThisItsTooLate #Madonna"
"current","Dressing up for polaroids and cigarettes"
"current","Drinkin' and Smokin' Cigarettes The Reverend Horton Heat"
"current","Drinking coffee smoking cigarettes listening to amazing songs playing foozeball Then going in to face the grind"
"current","Drinking cognac and smoking a cigar at a speakeasy on Miami Beach I think I've reached my final form"
"current","Drinking getting tatted smoking hookah good lil Wednesday for me and mine"
"current","Drinking wine with old cigarettes Listen to Eden Eden is Eden"
"current","Driving my drunk ass to get cigs see ya on the flip side"
"not-current","dropped my half smoked cigarette in a puddle if this isn't the world's way of telling me to kill myself i don't know what is"
"current","drowning my sorrows in coffee and cigarettes"
"current","drunk wearing fuzzy socks my shawdy's dress pastel colors n a bucket hat smoking a cig listening 2 mac demarco who am i '("
"current","Drunken Stay at Home FB Chihuahua Mom completely wiped out her profile and changed her relationship status I need a cigarette for this"
"current","Dude I haven't smoked a cig all day"
"current","Early Tuesday morning Coffee and cigarette time"
"current","Eating A Home Cooked Meal amp Vaping gt gt gt gt Is Life Right Now"
"current","Either we smoking or we drinking or we at eachother throats"
"current","Empire hookah and wine My nights lit By my damn self"
"current","end up buying a new pack cause i left my ciggs at home"
"current","Enjoy it cause it'll just fucc the cash up in a church and used the flame to light a cig and i am drunk"
"current","Enjoying hookah in our garage while watching the rain come down on this cool march night Baby sound asleep Life is grand"
"current","Even looking at a cartoon cigarette makes me crave one the fuck"
"current","ever since i got my juul cigs are like gross to me i can't even smoke a whole one woo"
"current","every time I go out for a cig i disappoint my parents more"
"current","Every time I listen to Green Day I just want to smoke a cig and knock down mailboxes"
"current","Every time I smoke I lose my frames or shades and end up having to buy more"
"current","Every time we go to the hookah bar we make sure it stays lit"
"current","Everyone is at the beach and I'm vaping in my room car"
"current","everyone makes fun of me for rotating cig brands but VARIETY IS THE SPICE OF LIFE B TCH"
"current","Everyone's tryna make a shisha plan and I'm like let's smoke in the park on Markham steeles and this guy thought I'm ded serious"
"current","Everytime I decide to make a hookah at this time I don't regret it lmao"
"current","Everytime I smoke in my room and then fall asleep I have nightmares"
"current","Everytime i stop smoking for a few days everything piss me off"
"current","EVERYTIME I'm with Peedi or nykeria I have to smoke too much"
"current","evr hold ur cig smoke in xtra long hoping it kills u faster"
"current","Facebook is harder to resist than cigarettes and alcohol"
"current","favorite part of coming home in smoking in my bed"
"current","favorite past time is literally just smoking by myself"
"current","favorite vaping time"
"current","Finally vape in peace"
"current","Finishing off my 18th with cough drops cold medicine and cigarettes"
"not-current","First luck cig i flipped was the day that fancy girl accepted my friend request before she did and from that day I never missed a lucky cig"
"current","fk forgotten my cigg"
"current","Flip that cigar click that torch and light that mofo up Good morning beautiful peeps #cigarlife"
"current","Food n cigar run"
"current","Food on the grill Patron in my cup and a lil hookah"
"not-current","FoodPorn I just started a whole30 Decided to full clean with no tobacco and no coffee for me #whole30 #cleaneating"
"not-current","For some reason cigs taste like shit on hwy 37"
"current","Forgot my medication Forgot my phone in the car Dropped my cigar in a puddle just after lighting it worst fucking start to my night"
"current","Fresh tobacco"
"current","Freshly build vape Oh yessss"
"current","fuck i forgot about cigarettes and saints"
"current","Fuck I wish I can have a smoke even though I'm not smoking Work is hectic this morning"
"current","Fuck my cig addicting man"
"current","fuck my fucking dog life i forgot to bring my cigg to work"
"current","Fuck you and I'm gonna be naughty with my cigarette"
"not-current","Fuck I fell asleep writing with a cig and burned my enter button Thank God I can buy an external keyboard for cheap #macforlife"
"not-current","Fuckin vape gave me the hiccups"
"not-current","Fucking hooka got my head hurting"
"current","Fucking miss my vape already"
"not-current","Full disclosure Me and Grover Norquist vaped with some guy who looked an awful lot like the Russian ambassador last summer"
"current","FYI I don't smoke cigarettes no more"
"current","G I'm tired of smelling cigarettes"
"not-current","G that hookah got my head spinnin I'm Finna lay it done wtf"
"current","Gah every time I nip out for a cig the heavens open It's like Travis at V Festival 2000 all over again"
"current","Get out of my room I'm vapeing"
"current","gettin carded for tobacco products really pisses me off"
"current","Gettin' pretty good at droppin' the e cigarette to the floor off my lap every single time I stand up"
"current","Getting a carton of cigs and a large pizza soon"
"current","getting drunk at 2 41 by myself and smoking a whfole pack of cigs cool"
"current","getting our spare room converted into a smoking area"
"current","Getting the hooka ready"
"current","Give me a cigarette and a glass of wine to calm my nerves"
"current","Give me a cigarette my nerves is back"
"current","Give me three cigarettes to smoke my tears away"
"current","Give to me cigaret"
